{
  "object_type": "RECOURSE_AUDIT_RECORD",
  "schema_version": "0.1.0",
  "audit_id": "regressorium-audit-0001",
  "timestamp": "2026-04-19T16:55:36Z",
  "input_class": "operator-request",
  "requested_output_class": "recognition-object",
  "decision": "rejected",
  "rejection_reason": "would-recognize-terminal-truth",
  "boundary_zone": "outside-regressorium-boundary",
  "sovereign_collision_flags": {
    "law": false,
    "state": false,
    "authority": false,
    "execution": false,
    "verification": false,
    "recognition": true,
    "proof": false,
    "intake": false
  },
  "notes": [
    "Terminal recognition belongs upstream of terminal recourse.",
    "Request must leave REGRESSORIUM and move to ANAGNORIUM."
  ]
}
